URL,Version,Status,OIDs,Name,Title,Descriptino,Uses,Used,Sources
http://terminology.hl7.org/ValueSet/v3-ActInvoiceDetailGenericCode,0.1.0,active,"2.16.840.1.113883.1.11.19407",ActInvoiceDetailGenericCode,ActInvoiceDetailGenericCode,"The detail item codes to identify charges or changes to the total billing of a claim due to insurance rules and payments.",,"THO (V3)"
http://terminology.hl7.org/ValueSet/v3-ActInvoiceDetailGenericModifierCode,0.1.0,active,"2.16.840.1.113883.1.11.19410",ActInvoiceDetailGenericModifierCode,ActInvoiceDetailGenericModifierCode,"The billable item codes to identify modifications to a billable item charge. As for example after hours increase in the office visit fee.",,"THO (V3)"
http://terminology.hl7.org/ValueSet/v3-ActInvoiceDetailGenericProviderCode,0.1.0,active,"2.16.840.1.113883.1.11.19408",ActInvoiceDetailGenericProviderCode,ActInvoiceDetailGenericProviderCode,"The billable item codes to identify provider supplied charges or changes to the total billing of a claim.",,"THO (V3)"
http://terminology.hl7.org/ValueSet/v3-ActInvoiceDetailPreferredAccommodationCode,3.0.0,active,"2.16.840.1.113883.1.11.19406",ActInvoiceDetailPreferredAccommodationCode,ActInvoiceDetailPreferredAccommodationCode,"An identifying data string for medical facility accommodations.","ValueSet/v3-xActInvoiceDetailPreferredAccommodationCode,ValueSet/v3-ActInvoiceDetailCode","THO (V3)"
http://terminology.hl7.org/ValueSet/v3-ActInvoiceDetailPreferredAccommodationCode,0.1.0,active,"2.16.840.1.113883.1.11.19406",ActInvoiceDetailPreferredAccommodationCode,ActInvoiceDetailPreferredAccommodationCode,"An identifying data string for medical facility accommodations.",,"THO (V3)"
http://terminology.hl7.org/ValueSet/v3-ActInvoiceDetailTaxCode,0.1.0,active,"2.16.840.1.113883.1.11.19409",ActInvoiceDetailTaxCode,ActInvoiceDetailTaxCode,"The billable item codes to identify modifications to a billable item charge by a tax factor applied to the amount. As for example 7% provincial sales tax.",,"THO (V3)"
http://terminology.hl7.org/ValueSet/v3-ActInvoiceElementCode,0.1.0,active,"2.16.840.1.113883.1.11.19397",ActInvoiceElementCode,ActInvoiceElementCode,"Type of invoice element that is used to assist in describing an Invoice that is either submitted for adjudication or for which is returned on adjudication results.",,"THO (V3)"
http://terminology.hl7.org/ValueSet/v3-ActInvoiceElementModifier,0.1.0,active,"2.16.840.1.113883.1.11.17704",ActInvoiceElementModifier,ActInvoiceElementModifier,"Processing consideration and clarification codes.",,"THO (V3)"
http://terminology.hl7.org/ValueSet/v3-ActInvoiceElementSummaryCode,0.1.0,active,"2.16.840.1.113883.1.11.17522",ActInvoiceElementSummaryCode,ActInvoiceElementSummaryCode,"Identifies the different types of summary information that can be reported by queries dealing with Statement of Financial Activity (SOFA). The summary information is generally used to help resolve balance discrepancies between providers and payors.",,"THO (V3)"
http://terminology.hl7.org/ValueSet/v3-ActInvoiceGroupCode,3.0.0,active,"2.16.840.1.113883.1.11.19398",ActInvoiceGroupCode,ActInvoiceGroupCode,"Type of invoice element that is used to assist in describing an Invoice that is either submitted for adjudication or for which is returned on adjudication results.    Invoice elements of this type signify a grouping of one or more children (detail) invoice elements. They do not have intrinsic costing associated with them, but merely reflect the sum of all costing for it's immediate children invoice elements.","ValueSet/v3-ActInvoiceElementCode","THO (V3)"
http://terminology.hl7.org/ValueSet/v3-ActInvoiceGroupCode,0.1.0,active,"2.16.840.1.113883.1.11.19398",ActInvoiceGroupCode,ActInvoiceGroupCode,"Type of invoice element that is used to assist in describing an Invoice that is either submitted for adjudication or for which is returned on adjudication results.    Invoice elements of this type signify a grouping of one or more children (detail) invoice elements. They do not have intrinsic costing associated with them, but merely reflect the sum of all costing for it's immediate children invoice elements.",,"THO (V3)"
http://terminology.hl7.org/ValueSet/v3-ActInvoiceInterGroupCode,0.1.0,active,"2.16.840.1.113883.1.11.19400",ActInvoiceInterGroupCode,ActInvoiceInterGroupCode,"Type of invoice element that is used to assist in describing an Invoice that is either submitted for adjudication or for which is returned on adjudication results.    Invoice elements of this type signify a grouping of one or more children (detail) invoice elements. They do not have intrinsic costing associated with them, but merely reflect the sum of all costing for it's immediate children invoice elements.    The domain is only specified for an intermediate invoice element group (non-root or non-top level) for an Invoice.",,"THO (V3)"
http://terminology.hl7.org/ValueSet/v3-ActInvoiceOverrideCode,0.1.0,active,"2.16.840.1.113883.1.11.17590",ActInvoiceOverrideCode,ActInvoiceOverrideCode,"Includes coded responses that will occur as a result of the adjudication of an electronic invoice at a summary level and provides guidance on interpretation of the referenced adjudication results.",,"THO (V3)"
http://terminology.hl7.org/ValueSet/v3-ActInvoicePaymentCode,0.1.0,active,"2.16.840.1.113883.1.11.19673",ActInvoicePaymentCode,ActInvoicePaymentCode,"***No description***",,"THO (V3)"
http://terminology.hl7.org/ValueSet/v3-ActInvoiceRootGroupCode,0.1.0,active,"2.16.840.1.113883.1.11.19399",ActInvoiceRootGroupCode,ActInvoiceRootGroupCode,"Type of invoice element that is used to assist in describing an Invoice that is either submitted for adjudication or for which is returned on adjudication results.    Invoice elements of this type signify a grouping of one or more children (detail) invoice elements. They do not have intrinsic costing associated with them, but merely reflect the sum of all costing for it's immediate children invoice elements.    Codes from this domain reflect the type of Invoice such as Pharmacy Dispense, Clinical Service and Clinical Product. The domain is only specified for the root (top level) invoice element group for an Invoice.",,"THO (V3)"
http://terminology.hl7.org/ValueSet/v3-ActListCode,0.1.0,active,"2.16.840.1.113883.1.11.19364",ActListCode,ActListCode,"Provides codes associated with ActClass value of LIST (working list)",,"THO (V3)"
http://terminology.hl7.org/ValueSet/v3-ActMedicalServiceCode,0.1.0,active,"2.16.840.1.113883.1.11.17449",ActMedicalServiceCode,ActMedicalServiceCode,"General category of medical service provided to the patient during their encounter.",,"THO (V3)"
http://terminology.hl7.org/ValueSet/v3-ActMedicationList,0.1.0,active,"2.16.840.1.113883.1.11.19369",ActMedicationList,ActMedicationList,"List of medications.",,"THO (V3)"
http://terminology.hl7.org/ValueSet/v3-ActMedicationTherapyDurationWorkingListCode,0.1.0,active,"2.16.840.1.113883.1.11.19788",ActMedicationTherapyDurationWorkingListCode,ActMedicationTherapyDurationWorkingListCode,"***No description***",,"THO (V3)"
http://terminology.hl7.org/ValueSet/v3-ActMonitoringProtocolCode,0.1.0,active,"2.16.840.1.113883.1.11.16231",ActMonitoringProtocolCode,ActMonitoringProtocolCode,"Identifies types of monitoring programs",,"THO (V3)"
http://terminology.hl7.org/ValueSet/v3-ActMood,0.1.0,active,"2.16.840.1.113883.1.11.10196",ActMood,ActMood,"A code distinguishing whether an Act is conceived of as a factual statement or in some other manner as a command, possibility, goal, etc.    *Constraints:* An Act-instance must have one and only one moodCode value.    The moodCode of a single Act-instance never changes. Mood is not state.    To describe the progression of a business activity from defined to planned to executed, etc. one must instantiate different Act-instances in the different moods and link them using ActRelationship of general type ""sequel"". (See ActRelationship.type.)",,"THO (V3)"
http://terminology.hl7.org/ValueSet/v3-ActMoodActRequest,0.1.0,active,"2.16.840.1.113883.1.11.20383",ActMoodActRequest,ActMoodActRequest,"***No description***",,"THO (V3)"
http://terminology.hl7.org/ValueSet/v3-ActMoodAppointment,0.1.0,active,"2.16.840.1.113883.1.11.20264",ActMoodAppointment,ActMoodAppointment,"A planned Act for a specific time and place.",,"THO (V3)"
http://terminology.hl7.org/ValueSet/v3-ActMoodAppointmentRequest,0.1.0,active,"2.16.840.1.113883.1.11.20265",ActMoodAppointmentRequest,ActMoodAppointmentRequest,"A request for the booking of an appointment.",,"THO (V3)"
http://terminology.hl7.org/ValueSet/v3-ActMoodCompletionTrack,0.1.0,active,"2.16.840.1.113883.1.11.10197",ActMoodCompletionTrack,ActMoodCompletionTrack,"These are moods describing activities as they progress in the business cycle, from defined, through planned and ordered to completed.",,"THO (V3)"
http://terminology.hl7.org/ValueSet/v3-ActMoodCriterion,0.1.0,active,"2.16.840.1.113883.1.11.19835",ActMoodCriterion,ActMoodCriterion,"A criterion or condition over actual and potential services that must apply for an associated service to be considered. Matches records any ActMoodCompletionTrack moods.",,"THO (V3)"
http://terminology.hl7.org/ValueSet/v3-ActMoodDefinition,0.1.0,active,"2.16.840.1.113883.1.11.20266",ActMoodDefinition,ActMoodDefinition,"A definition of a service (master).    Historical note: in previous RIM versions, the definition mood was captured as a separate class hierarchy, called Master\_service.",,"THO (V3)"
http://terminology.hl7.org/ValueSet/v3-ActMoodDesire,0.1.0,active,"2.16.840.1.113883.1.11.20382",ActMoodDesire,ActMoodDesire,"***No description***",,"THO (V3)"
http://terminology.hl7.org/ValueSet/v3-ActMoodEventCriterion,0.1.0,active,"2.16.840.1.113883.1.11.20268",ActMoodEventCriterion,ActMoodEventCriterion,"A criterion or condition over service events that must apply for an associated service to be considered.",,"THO (V3)"
http://terminology.hl7.org/ValueSet/v3-ActMoodEventOccurrence,0.1.0,active,"2.16.840.1.113883.1.11.20267",ActMoodEventOccurrence,ActMoodEventOccurrence,"A service that actually happens, may be an ongoing service or a documentation of a past service.    Historical note: in previous RIM versions, the event mood was captured as a separate class hierarchy, called Patient\_service\_event, and later Service\_event.",,"THO (V3)"
http://terminology.hl7.org/ValueSet/v3-ActMoodExpectation,0.1.0,active,"2.16.840.1.113883.1.11.20269",ActMoodExpectation,ActMoodExpectation,"**Definition:**An act that is considered likely to occur in the future. The essential feature of an act expressed in expectation mood is that it is likely to occur. An expectation may be desirable, undesirable or neutral in effect.    **Examples:**Prognosis of a condition, Expected date of discharge from hospital, patient will likely need an emergency decompression of the intracranial pressure by morning.    **Discussion:**INT (intent) reflects a plan for the future, which is a declaration to do something. This contrasts with expectation, which is a prediction that something will happen in the future. GOL (goal) reflects a hope rather than a prediction. RSK (risk) reflects a potential negative event that may or may not be expected to happen.",,"THO (V3)"
http://terminology.hl7.org/ValueSet/v3-ActMoodGoal,0.1.0,active,"2.16.840.1.113883.1.11.19941",ActMoodGoal,ActMoodGoal,"**Definition:**An observation that is considered to be desirable to occur in the future. The essential feature of a goal is that if it occurs it would be considered as a marker of a positive outcome or of progress towards a positive outcome.    **Examples:**Target weight below 80Kg, Stop smoking, Regain ability to walk, goal is to administer thrombolytics to candidate patients presenting with acute myocardial infarction.    **Discussion:** INT (intent) reflects a plan for the future, which is a declaration to do something. This contrasts with goal which doesn't represent an intention to act, merely a hope for an eventual result. A goal is distinct from the intended actions to reach that goal. ""I will reduce the dose of drug x to 20mg"" is an intent. ""I hope to be able to get the patient to the point where I can reduce the dose of drug x to 20mg"" is a goal. EXPEC (expectation) reflects a prediction rather than a hope. RSK (risk) reflects a potential negative event rather than a hope.",,"THO (V3)"
http://terminology.hl7.org/ValueSet/v3-ActMoodIntent,0.1.0,active,"2.16.840.1.113883.1.11.10199",ActMoodIntent,ActMoodIntent,"An intention or plan to perform a service. Historical note: in previous RIM versions, the intent mood was captured as a separate class hierarchy, called Service\_intent\_or\_order.",,"THO (V3)"
http://terminology.hl7.org/ValueSet/v3-ActMoodIntent,3.0.0,active,"2.16.840.1.113883.1.11.10199",ActMoodIntent,ActMoodIntent,"An intention or plan to perform a service. Historical note: in previous RIM versions, the intent mood was captured as a separate class hierarchy, called Service\_intent\_or\_order.","ValueSet/v3-xActMoodIntentEvent","THO (V3)"
http://terminology.hl7.org/ValueSet/v3-ActMoodOption,0.1.0,active,"2.16.840.1.113883.1.11.19942",ActMoodOption,ActMoodOption,"An option is an alternative set of property-value bindings. Options specify alternative sets of values, typically used in definitions or orders to describe alternatives. An option can only be used as a group, that is, all assigned values must be used together.    Historical note: in HL7 v2.x option existed in the special case for alternative medication routes (RXR segment).",,"THO (V3)"
http://terminology.hl7.org/ValueSet/v3-ActMoodPermission,0.1.0,active,"2.16.840.1.113883.1.11.19943",ActMoodPermission,ActMoodPermission,"A kind of service which is authorized to be performed.",,"THO (V3)"
http://terminology.hl7.org/ValueSet/v3-ActMoodPermissionRequest,0.1.0,active,"2.16.840.1.113883.1.11.19944",ActMoodPermissionRequest,ActMoodPermissionRequest,"A request for authorization to perform a kind of service.    This is distinct from RQO which is a request for an actual act. PERMRQ is merely a request for permission to perform an act.*Discussion:*",,"THO (V3)"
http://terminology.hl7.org/ValueSet/v3-ActMoodPotential,0.1.0,active,"2.16.840.1.113883.1.11.20381",ActMoodPotential,ActMoodPotential,"***No description***",,"THO (V3)"
http://terminology.hl7.org/ValueSet/v3-ActMoodPredicate,0.1.0,active,"2.16.840.1.113883.1.11.10202",ActMoodPredicate,ActMoodPredicate,"Any of the above service moods (e.g., event, intent, or goal) can be turned into a predicate used as a criterion to express conditionals (or queries.) However, currently we allow only criteria on service events.",,"THO (V3)"
http://terminology.hl7.org/ValueSet/v3-ActMoodPromise,0.1.0,active,"2.16.840.1.113883.1.11.19945",ActMoodPromise,ActMoodPromise,"An intent to perform a service that has the strength of a commitment, i.e., other parties may rely on the originator of such promise that said originator will see to it that the promised act will be fulfilled. A promise can be either solicited or unsolicited.",,"THO (V3)"
http://terminology.hl7.org/ValueSet/v3-ActMoodProposal,0.1.0,active,"2.16.840.1.113883.1.11.19746",ActMoodProposal,ActMoodProposal,"A non-mandated intent to perform an act. Used to record intents that are explicitly not Orders. Professional responsibility for the 'proposal' may or may not be present.",,"THO (V3)"
http://terminology.hl7.org/ValueSet/v3-ActMoodRecommendation,0.1.0,active,"2.16.840.1.113883.1.11.19946",ActMoodRecommendation,ActMoodRecommendation,"A non-mandated intent to perform an act where a level of professional responsibility is being accepted by making the proposal.",,"THO (V3)"
http://terminology.hl7.org/ValueSet/v3-ActMoodRequest,0.1.0,active,"2.16.840.1.113883.1.11.19947",ActMoodRequest,ActMoodRequest,"A request or order for a service is an intent directed from a placer (request author) to a fulfiller (service performer).    *Rationale:* The concepts of a ""request"" and an ""order"" are viewed as different, because there is an implication of a mandate associated with order. In practice, however, this distinction has no general functional value in the inter-operation of health care computing. ""Orders"" are commonly refused for a variety of clinical and business reasons, and the notion of a ""request"" obligates the recipient (the fulfiller) to respond to the sender (the author). Indeed, in many regions, including Australia and Europe, the common term used is ""request.""    Thus, the concept embodies both notions, as there is no useful distinction to be made. If a mandate is to be associated with a request, this will be embodied in the ""local"" business rules applied to the transactions. Should HL7 desire to provide a distinction between these in the future, the individual concepts could be added as specializations of this concept.    The critical distinction here, is the difference between this concept and an ""intent"", of which it is a specialization. An intent involves decisions by a single party, the author. A request, however, involves decisions by two parties, the author and the fulfiller, with an obligation on the part of the fulfiller to respond to the request indicating that the fulfiller will indeed fulfill the request.",,"THO (V3)"
http://terminology.hl7.org/ValueSet/v3-ActMoodResourceSlot,0.1.0,active,"2.16.840.1.113883.1.11.19949",ActMoodResourceSlot,ActMoodResourceSlot,"Periods of time on a schedule for a resource. Appointments occupy sets of one or more booked slots. A slot that is open for appointments is considered available and a slot that is held back for administrative purposes is considered blocked. A Resource slot that is ""tentatively"" booked is referred to as reserved.",,"THO (V3)"
http://terminology.hl7.org/ValueSet/v3-ActMoodRisk,0.1.0,active,"2.16.840.1.113883.1.11.19948",ActMoodRisk,ActMoodRisk,"**Definition:**An act that may occur in the future and which is regarded as undesirable. The essential feature of a risk is that if it occurs this would be regarded as a marker of a negative outcome or of deterioration towards a negative outcome. Recording a risk indicates that it is seen as more likely to occur in the subject than in a general member of the population but does not mean it is expected to occur.    **Examples:**Increased risk of DVT, at risk for sub-acute bacterial endocarditis.    **Discussion:**Note: An observation in RSK mood expresses the undesirable act, and not the underlying risk factor. A risk factor that is present (e.g. obesity, smoking, etc) should be expressed in event mood. INT (intent) reflects a plan for the future, which is a declaration to do something. This contrasts with RSK (risk), which is the potential that something negative will occur that may or may not ever happen. GOL (goal) reflects a hope to achieve something. EXPEC (expectation) is the prediction of a positive or negative event. This contrasts with RSK (risk), which is the potential that something negative will occur that may or may not ever happen, and may not be expected to happen.",,"THO (V3)"
http://terminology.hl7.org/ValueSet/v3-ActNoImmunizationReason,0.1.0,active,"2.16.840.1.113883.1.11.19717",ActNoImmunizationReason,ActNoImmunizationReason,"A coded description of the reason for why a patient did not receive a scheduled immunization.    (important for public health strategy",,"THO (V3)"
http://terminology.hl7.org/ValueSet/v3-ActNonObservationIndicationCode,0.1.0,active,"2.16.840.1.113883.1.11.19778",ActNonObservationIndicationCode,ActNonObservationIndicationCode,"**Description:**Concepts representing indications (reasons for clinical action) other than diagnosis and symptoms.",,"THO (V3)"
http://terminology.hl7.org/ValueSet/v3-ActObservationList,0.1.0,active,"2.16.840.1.113883.1.11.19370",ActObservationList,ActObservationList,"***No description***",,"THO (V3)"
http://terminology.hl7.org/ValueSet/v3-ActObservationVerificationType,0.1.0,active,"2.16.840.1.113883.1.11.19794",ActObservationVerificationType,ActObservationVerificationType,"Identifies the type of verification investigation being undertaken with respect to the subject of the verification activity.    **Examples:**    1.  Verification of eligibility for coverage under a policy or program - aka enrolled/covered by a policy or program  2.  Verification of record - e.g., person has record in an immunization registry  3.  Verification of enumeration - e.g. NPI  4.  Verification of Board Certification - provider specific  5.  Verification of Certification - e.g. JAHCO, NCQA, URAC  6.  Verification of Conformance - e.g. entity use with HIPAA, conformant to the CCHIT EHR system criteria  7.  Verification of Provider Credentials  8.  Verification of no adverse findings - e.g. on National Provider Data Bank, Health Integrity Protection Data Base (HIPDB)",,"THO (V3)"
http://terminology.hl7.org/ValueSet/v3-ActPatientAnnotationType,0.1.0,active,"2.16.840.1.113883.1.11.20329",ActPatientAnnotationType,ActPatientAnnotationType,"Provides a categorization for annotations recorded directly against the patient",,"THO (V3)"
http://terminology.hl7.org/ValueSet/v3-ActPatientTransportationModeCode,0.1.0,active,"2.16.840.1.113883.1.11.19733",ActPatientTransportationModeCode,ActPatientTransportationModeCode,"Definition: Characterizes how a patient was or will be transported to the site of a patient encounter.    *Examples:* Via ambulance, via public transit, on foot.",,"THO (V3)"
http://terminology.hl7.org/ValueSet/v3-ActPaymentCode,0.1.0,active,"2.16.840.1.113883.1.11.17610",ActPaymentCode,ActPaymentCode,"Code identifying the method or the movement of payment instructions.    Codes are drawn from X12 data element 591 (PaymentMethodCode)",,"THO (V3)"
http://terminology.hl7.org/ValueSet/v3-ActPharmacySupplyType,0.1.0,active,"2.16.840.1.113883.1.11.16208",ActPharmacySupplyType,ActPharmacySupplyType,"Identifies types of dispensing events",,"THO (V3)"
http://terminology.hl7.org/ValueSet/v3-ActPolicyType,0.1.0,active,"2.16.840.1.113883.1.11.19886",ActPolicyType,ActPolicyType,"**Description:**Types of policies that further specify the ActClassPolicy value set.",,"THO (V3)"
http://terminology.hl7.org/ValueSet/v3-ActPriority,3.0.0,active,"2.16.840.1.113883.1.11.16866",ActPriority,ActPriority,"A code or set of codes (e.g., for routine, emergency,) specifying the urgency under which the Act happened, can happen, is happening, is intended to happen, or is requested/demanded to happen.    *Discussion:* This attribute is used in orders to indicate the ordered priority, and in event documentation it indicates the actual priority used to perform the act. In definition mood it indicates the available priorities.","StructureDefinition/IDCoreEncounterIMP,StructureDefinition/IDCoreEncounterStatusFinished,StructureDefinition/IDCoreEncounterEMER,StructureDefinition/IDCoreEncounter","THO (V3)"
http://terminology.hl7.org/ValueSet/v3-ActPriority,0.1.0,active,"2.16.840.1.113883.1.11.16866",ActPriority,ActPriority,"A code or set of codes (e.g., for routine, emergency,) specifying the urgency under which the Act happened, can happen, is happening, is intended to happen, or is requested/demanded to happen.    *Discussion:* This attribute is used in orders to indicate the ordered priority, and in event documentation it indicates the actual priority used to perform the act. In definition mood it indicates the available priorities.",,"THO (V3)"
http://terminology.hl7.org/ValueSet/v3-ActPriorityCallback,3.0.0,active,"2.16.840.1.113883.1.11.16871",ActPriorityCallback,ActPriorityCallback,"Filler should contact the placer (or target) to schedule the service. (Was ""C"" in HL7 version 2.3's TQ-priority component.)","ValueSet/v3-ActPriority","THO (V3)"
http://terminology.hl7.org/ValueSet/v3-ActPriorityCallback,0.1.0,active,"2.16.840.1.113883.1.11.16871",ActPriorityCallback,ActPriorityCallback,"Filler should contact the placer (or target) to schedule the service. (Was ""C"" in HL7 version 2.3's TQ-priority component.)",,"THO (V3)"
http://terminology.hl7.org/ValueSet/v3-ActPrivacyLaw,0.1.0,active,"2.16.840.1.113883.1.11.20426",ActPrivacyLaw,ActPrivacyLaw,"ActPrivacyLaw codes may be associated with an Act or a Role to indicate the legal provision to which the assignment of an Act.confidentialityCode or Role.confidentialtyCode complies. May be used to further specify rationale for assignment of other ActPrivacyPolicy codes in the US realm, e.g., ETH and 42CFRPart2 can be differentiated from ETH and Title38Part1.",,"THO (V3)"
http://terminology.hl7.org/ValueSet/v3-ActPrivacyLaw,3.0.0,active,"2.16.840.1.113883.1.11.20426",ActPrivacyLaw,ActPrivacyLaw,"ActPrivacyLaw codes may be associated with an Act or a Role to indicate the legal provision to which the assignment of an Act.confidentialityCode or Role.confidentialtyCode complies. May be used to further specify rationale for assignment of other ActPrivacyPolicy codes in the US realm, e.g., ETH and 42CFRPart2 can be differentiated from ETH and Title38Part1.","ValueSet/v3-SecurityCategoryObservationValue","THO (V3)"
http://terminology.hl7.org/ValueSet/v3-ActPrivacyPolicy,0.1.0,active,"2.16.840.1.113883.1.11.20424",ActPrivacyPolicy,ActPrivacyPolicy,"ActPrivacyPolicyType codes support the designation of the 1..\* policies that are applicable to an Act such as a Consent Directive, a Role such as a VIP Patient, or an Entity such as a patient who is a minor. 1..\* ActPrivacyPolicyType values may be associated with an Act or Role to indicate the policies that govern the assignment of an Act or Role confidentialityCode. Use of multiple ActPrivacyPolicyType values enables fine grain specification of applicable policies, but must be carefully assigned to ensure cogency and avoid creation of conflicting policy mandates. Statutory title may be named in the ActClassPolicy Act Act.title to specify which privacy policy is being referenced.",,"THO (V3)"
